{
    "logDir": "/root/backup_logs",
    "email": "felix.dobler.fd@gmail.com",
    "rsyncTargetHost": "backup:",
    "components": {
        "os": {
            "enabled": false,
            "script": "rsync_backup.sh",
            "source": "/",
            "useDefaultFiles": true,
            "useDefaultExcludes": true,
            "files": "files_linux",
            "excludeFile": "exclude",
            "dstRelativePath": "rootfs",
            "additionalFiles": ["/etc/hosts", "/etc/fstab"]
        },
        "nextcloud": {
            "enabled": true,
            "tmpBackupDir": "/backups/tmp/nextcloud",
            "dockerMountDir": "/nextcloud",
            "script": "nextcloud_backup.sh",
            "dstRelativePath": "nextcloud"
        },
        "abc": {
            "enabled": false,
            "source": "/doesntexist",
            "dstRelativePath": "abc",
            "script": ""
        }
    }
}
